{
  "$schema": "../schema/section-contract.schema.json",
  "id": "conversion.subscribe-band",
  "kind": "section",
  "version": "1.0.0",
  "title": "Subscribe band",
  "purpose": "Band with newsletter icon, title, email field, consent and submit; closes article-like pages.",
  "source": {
    "file": "src/components/content/subscribe.jsx",
    "tag": "SubscribeBand",
    "lines": "79-102",
    "id": "subscribe-jsx#SubscribeBand"
  },
  "sourceAlternates": [
    {
      "file": "src/components/extra/events.jsx",
      "tag": "EventNewsletterBand",
      "lines": "165-189",
      "id": "events-jsx#EventNewsletterBand"
    },
    {
      "file": "src/components/extra/author.jsx",
      "tag": "AuthorSubscribe",
      "lines": "86-117",
      "id": "author-jsx#AuthorSubscribe"
    }
  ],
  "semantic": {
    "id": "conversion.subscribe-band",
    "category": "CONVERSION"
  },
  "retrievalEligible": true,
  "content": {
    "fields": {
      "title": {
        "type": "text",
        "maxWords": 8,
        "required": true
      },
      "emailLabel": {
        "type": "text",
        "maxWords": 2,
        "required": true
      },
      "consent": {
        "type": "text",
        "maxWords": 10,
        "required": false
      },
      "submit": {
        "type": "link",
        "labelMaxWords": 2,
        "required": true
      },
      "icon": {
        "type": "asset",
        "roles": [
          "spot-illustration"
        ],
        "required": true
      }
    },
    "copyBudgetBasis": "estimated: layout-fit budgets set from the placeholder lengths recorded in the page specs; see extraction/measured-values.json copyBudgets for the role-class maxima that were verified"
  },
  "variants": [
    "default",
    "events",
    "author"
  ],
  "allowedSurfaces": [
    "cream"
  ],
  "constraints": {
    "maxPerPage": 1
  },
  "motion": {
    "allowedPatterns": [
      "offset-lift"
    ],
    "default": "offset-lift",
    "reducedMotionFallback": "static"
  },
  "responsive": {
    "columns": {
      "xl": 1,
      "lg": 1,
      "md": 1,
      "sm": 1
    },
    "stackBelowPx": null,
    "hiddenBelowPx": null,
    "evidence": "no section-specific breakpoint behaviour is recorded in the page specs; the section follows the container grid"
  },
  "generatedAssetRoles": [
    "generated-illustration",
    "generic-ui-glyph"
  ],
  "evidence": {
    "level": "measured",
    "specRefs": [
      {
        "doc": "PAGES_SPEC_CONTENT.md",
        "lines": "296-305",
        "heading": "B2. `SubscribeBand` (after every blog post) [NEW]"
      }
    ],
    "note": null
  },
  "usedInTemplates": [
    "author",
    "blog-post",
    "event-detail"
  ],
  "tags": []
}
