{
  "$schema": "../schema/section-contract.schema.json",
  "id": "runtime.mobile-menu",
  "kind": "section",
  "version": "1.0.0",
  "title": "Mobile menu drawer",
  "purpose": "Full-screen slide-in navigation drawer below 1302px.",
  "source": {
    "file": "src/components/header/MobileMenu.jsx",
    "tag": "MobileMenu",
    "lines": "66-117",
    "id": "MobileMenu-jsx#MobileMenu"
  },
  "sourceAlternates": [],
  "semantic": {
    "id": "runtime.mobile-menu",
    "category": "RUNTIME"
  },
  "retrievalEligible": false,
  "content": {
    "fields": {
      "label": {
        "type": "text",
        "maxWords": 4,
        "required": false
      }
    },
    "copyBudgetBasis": "estimated: layout-fit budgets set from the placeholder lengths recorded in the page specs; see extraction/measured-values.json copyBudgets for the role-class maxima that were verified"
  },
  "variants": [
    "default"
  ],
  "allowedSurfaces": [
    "cream"
  ],
  "constraints": {
    "maxPerPage": 1
  },
  "motion": {
    "allowedPatterns": [
      "bar-slide"
    ],
    "default": "bar-slide",
    "reducedMotionFallback": "static"
  },
  "responsive": {
    "columns": {
      "xl": 1,
      "lg": 1,
      "md": 1,
      "sm": 1
    },
    "stackBelowPx": null,
    "hiddenBelowPx": null,
    "evidence": "no section-specific breakpoint behaviour is recorded in the page specs; the section follows the container grid"
  },
  "generatedAssetRoles": [],
  "evidence": {
    "level": "measured",
    "specRefs": [
      {
        "doc": "CLONE_SPEC.md",
        "lines": "248-256",
        "heading": "2e. Mobile / tablet menu (<1302)"
      }
    ],
    "note": null
  },
  "usedInTemplates": [
    "about",
    "author",
    "azure-waitlist",
    "blog-index",
    "blog-post",
    "book-brief",
    "book-chapter",
    "careers",
    "case-detail",
    "case-index",
    "community-code",
    "community-oss",
    "contact-chooser",
    "contact-form",
    "ecosystem-detail",
    "ecosystem-index",
    "eu-region",
    "event-detail",
    "events-index",
    "events-past",
    "gated-lp",
    "glossary-index",
    "glossary-term",
    "home",
    "learn-article",
    "learn-index",
    "legal-plain",
    "legal-toc",
    "lp-divemaxxing",
    "lp-ducklake-full",
    "lp-jev",
    "news-index",
    "persona-landing",
    "podcast-episode",
    "podcast-index",
    "pricing",
    "pricing-support",
    "product-ducklake",
    "product-feature",
    "product-hypertenancy",
    "product-overview",
    "product-persona",
    "prose-sidebar-form",
    "quack-index",
    "research-index",
    "research-paper",
    "split-form-lp",
    "startups",
    "support-hub",
    "trust-security",
    "video-detail",
    "video-index",
    "vs-comparison",
    "vs-index",
    "webinar-detail"
  ],
  "tags": [],
  "retrievalReason": "Slide-in drawer opened by the hamburger button; it is header runtime UI that locks page scroll and is not page content."
}
