{
  "$schema": "../schema/section-contract.schema.json",
  "id": "feature.dark-features",
  "kind": "section",
  "version": "1.0.0",
  "title": "Dark feature list",
  "purpose": "Dark band listing features that rise into view one by one.",
  "source": {
    "file": "src/components/extra/persona2.jsx",
    "tag": "DarkFeatures",
    "lines": "92-116",
    "id": "persona2-jsx#DarkFeatures"
  },
  "sourceAlternates": [],
  "semantic": {
    "id": "feature.dark-features",
    "category": "FEATURES"
  },
  "retrievalEligible": true,
  "content": {
    "fields": {
      "h2": {
        "type": "text",
        "maxWords": 8,
        "required": true
      },
      "items": {
        "type": "list",
        "minItems": 3,
        "maxItems": 6,
        "item": {
          "title": {
            "type": "text",
            "maxWords": 6,
            "required": true
          },
          "body": {
            "type": "text",
            "maxWords": 28,
            "required": true
          },
          "icon": {
            "type": "asset",
            "roles": [
              "generic-ui-glyph",
              "spot-illustration"
            ],
            "required": true
          }
        },
        "required": true
      }
    },
    "copyBudgetBasis": "estimated: layout-fit budgets set from the placeholder lengths recorded in the page specs; see extraction/measured-values.json copyBudgets for the role-class maxima that were verified"
  },
  "variants": [
    "default"
  ],
  "allowedSurfaces": [
    "ink"
  ],
  "constraints": {},
  "motion": {
    "allowedPatterns": [
      "feature-rise"
    ],
    "default": "feature-rise",
    "reducedMotionFallback": "static"
  },
  "responsive": {
    "columns": {
      "xl": 1,
      "lg": 1,
      "md": 1,
      "sm": 1
    },
    "stackBelowPx": null,
    "hiddenBelowPx": null,
    "evidence": "no section-specific breakpoint behaviour is recorded in the page specs; the section follows the container grid"
  },
  "generatedAssetRoles": [
    "generated-illustration",
    "generic-ui-glyph"
  ],
  "evidence": {
    "level": "measured",
    "specRefs": [
      {
        "doc": "PAGES_SPEC_EXTRA.md",
        "lines": "480-563",
        "heading": "X12. Persona landing `/product/for-founders`, `/product/for-operators` (one template, two "
      }
    ],
    "note": null
  },
  "usedInTemplates": [
    "persona-landing"
  ],
  "tags": []
}
