{
  "$schema": "../schema/section-contract.schema.json",
  "id": "runtime.read-ebook-bar",
  "kind": "section",
  "version": "1.0.0",
  "title": "Read ebook bar",
  "purpose": "Fixed bar offering the ebook on book chapter pages.",
  "source": {
    "file": "src/components/extra/bookChapter.jsx",
    "tag": "ReadEbookBar",
    "lines": "76-91",
    "id": "bookChapter-jsx#ReadEbookBar"
  },
  "sourceAlternates": [],
  "semantic": {
    "id": "runtime.read-ebook-bar",
    "category": "RUNTIME"
  },
  "retrievalEligible": false,
  "content": {
    "fields": {
      "label": {
        "type": "text",
        "maxWords": 4,
        "required": false
      }
    },
    "copyBudgetBasis": "estimated: layout-fit budgets set from the placeholder lengths recorded in the page specs; see extraction/measured-values.json copyBudgets for the role-class maxima that were verified"
  },
  "variants": [
    "default"
  ],
  "allowedSurfaces": [
    "cream"
  ],
  "constraints": {
    "maxPerPage": 1
  },
  "motion": {
    "allowedPatterns": [
      "bar-slide"
    ],
    "default": "bar-slide",
    "reducedMotionFallback": "static"
  },
  "responsive": {
    "columns": {
      "xl": 1,
      "lg": 1,
      "md": 1,
      "sm": 1
    },
    "stackBelowPx": null,
    "hiddenBelowPx": null,
    "evidence": "no section-specific breakpoint behaviour is recorded in the page specs; the section follows the container grid"
  },
  "generatedAssetRoles": [],
  "evidence": {
    "level": "measured",
    "specRefs": [
      {
        "doc": "PAGES_SPEC_EXTRA.md",
        "lines": "733-753",
        "heading": "X20. Book chapter summary `/duckdb-book-summary-chapter1` … `chapter11` (NEW)"
      }
    ],
    "note": null
  },
  "usedInTemplates": [
    "book-chapter"
  ],
  "tags": [],
  "retrievalReason": "Fixed bottom bar following the reader; sticky utility UI without independent content."
}
