{
  "$schema": "../schema/section-contract.schema.json",
  "id": "lp.numbered-list",
  "kind": "section",
  "version": "1.0.0",
  "title": "Numbered list band",
  "purpose": "LP band with a numbered list of items.",
  "source": {
    "file": "src/components/company/lp.jsx",
    "tag": "NumberedList",
    "lines": "224-238",
    "id": "lp-jsx#NumberedList"
  },
  "sourceAlternates": [],
  "semantic": {
    "id": "lp.numbered-list",
    "category": "CONTENT"
  },
  "retrievalEligible": true,
  "content": {
    "fields": {
      "h2": {
        "type": "text",
        "maxWords": 5,
        "required": true
      },
      "items": {
        "type": "list",
        "minItems": 3,
        "maxItems": 7,
        "item": {
          "title": {
            "type": "text",
            "maxWords": 6,
            "required": true
          },
          "body": {
            "type": "text",
            "maxWords": 30,
            "required": true
          }
        },
        "required": true
      }
    },
    "copyBudgetBasis": "estimated: layout-fit budgets set from the placeholder lengths recorded in the page specs; see extraction/measured-values.json copyBudgets for the role-class maxima that were verified"
  },
  "variants": [
    "default"
  ],
  "allowedSurfaces": [
    "white"
  ],
  "constraints": {},
  "motion": {
    "allowedPatterns": [
      "none"
    ],
    "default": "none",
    "reducedMotionFallback": "static"
  },
  "responsive": {
    "columns": {
      "xl": 1,
      "lg": 1,
      "md": 1,
      "sm": 1
    },
    "stackBelowPx": null,
    "hiddenBelowPx": null,
    "evidence": "no section-specific breakpoint behaviour is recorded in the page specs; the section follows the container grid"
  },
  "generatedAssetRoles": [],
  "evidence": {
    "level": "measured",
    "specRefs": [
      {
        "doc": "PAGES_SPEC_COMPANY.md",
        "lines": "278-304",
        "heading": "G. Gated LP template blocks"
      }
    ],
    "note": null
  },
  "usedInTemplates": [
    "gated-lp"
  ],
  "tags": []
}
