{
  "$schema": "../schema/section-contract.schema.json",
  "id": "hero.jev",
  "kind": "section",
  "version": "1.0.0",
  "title": "Calculator landing hero (dark)",
  "purpose": "Page-opening dark hero with a typed-text effect and flicker.",
  "source": {
    "file": "src/components/extra/jev.jsx",
    "tag": "Hero",
    "lines": "42-87",
    "id": "jev-jsx#Hero"
  },
  "sourceAlternates": [],
  "semantic": {
    "id": "hero.jev",
    "category": "HERO"
  },
  "retrievalEligible": true,
  "content": {
    "fields": {
      "h1": {
        "type": "text",
        "maxWords": 10,
        "required": true
      },
      "lede": {
        "type": "text",
        "maxWords": 30,
        "required": true
      },
      "action": {
        "type": "link",
        "labelMaxWords": 3,
        "required": true
      }
    },
    "copyBudgetBasis": "estimated: layout-fit budgets set from the placeholder lengths recorded in the page specs; see extraction/measured-values.json copyBudgets for the role-class maxima that were verified"
  },
  "variants": [
    "default"
  ],
  "allowedSurfaces": [
    "ink"
  ],
  "constraints": {
    "onePerPage": true,
    "mustFollowNav": true
  },
  "motion": {
    "allowedPatterns": [
      "flicker",
      "jev-type",
      "jev-cursor-blink"
    ],
    "default": "flicker",
    "reducedMotionFallback": "static"
  },
  "responsive": {
    "columns": {
      "xl": 1,
      "lg": 1,
      "md": 1,
      "sm": 1
    },
    "stackBelowPx": null,
    "hiddenBelowPx": null,
    "evidence": "no section-specific breakpoint behaviour is recorded in the page specs; the section follows the container grid"
  },
  "generatedAssetRoles": [],
  "evidence": {
    "level": "measured",
    "specRefs": [
      {
        "doc": "PAGES_SPEC_EXTRA.md",
        "lines": "754-810",
        "heading": "X21. Gated LP bodies (reuse G shell: `LPHero`, `LPSection`, FAQ, `GatedFormSection`)"
      }
    ],
    "note": null
  },
  "usedInTemplates": [
    "lp-jev"
  ],
  "tags": []
}
