{
  "$schema": "../schema/section-contract.schema.json",
  "id": "hero.research-paper",
  "kind": "section",
  "version": "1.0.0",
  "title": "Research paper hero",
  "purpose": "Page-opening: title, authors, venue and links for a research paper.",
  "source": {
    "file": "src/components/extra/research.jsx",
    "tag": "ResearchHero",
    "lines": "7-23",
    "id": "research-jsx#ResearchHero"
  },
  "sourceAlternates": [],
  "semantic": {
    "id": "hero.research-paper",
    "category": "HERO"
  },
  "retrievalEligible": true,
  "content": {
    "fields": {
      "h1": {
        "type": "text",
        "maxWords": 16,
        "required": true
      },
      "authors": {
        "type": "list",
        "minItems": 1,
        "maxItems": 8,
        "item": {
          "name": {
            "type": "text",
            "maxWords": 3,
            "required": true
          }
        },
        "required": true
      },
      "venue": {
        "type": "text",
        "maxWords": 8,
        "required": false
      },
      "action": {
        "type": "link",
        "labelMaxWords": 3,
        "required": false
      }
    },
    "copyBudgetBasis": "estimated: layout-fit budgets set from the placeholder lengths recorded in the page specs; see extraction/measured-values.json copyBudgets for the role-class maxima that were verified"
  },
  "variants": [
    "default"
  ],
  "allowedSurfaces": [
    "cream"
  ],
  "constraints": {
    "onePerPage": true,
    "mustFollowNav": true
  },
  "motion": {
    "allowedPatterns": [
      "none"
    ],
    "default": "none",
    "reducedMotionFallback": "static"
  },
  "responsive": {
    "columns": {
      "xl": 1,
      "lg": 1,
      "md": 1,
      "sm": 1
    },
    "stackBelowPx": null,
    "hiddenBelowPx": null,
    "evidence": "no section-specific breakpoint behaviour is recorded in the page specs; the section follows the container grid"
  },
  "generatedAssetRoles": [],
  "evidence": {
    "level": "measured",
    "specRefs": [
      {
        "doc": "PAGES_SPEC_EXTRA.md",
        "lines": "461-477",
        "heading": "X11. Research paper `/research/:slug` (6; samples `declarative-caching-in-motherduck`, `mo"
      }
    ],
    "note": null
  },
  "usedInTemplates": [
    "research-paper"
  ],
  "tags": []
}
