{
  "$schema": "../schema/section-contract.schema.json",
  "id": "media.live-embed",
  "kind": "section",
  "version": "1.0.0",
  "title": "Live embedded app frame",
  "purpose": "Heading and an embedded interactive app frame (not loaded in the clone).",
  "source": {
    "file": "src/components/marketing/feature.jsx",
    "tag": "LiveEmbed",
    "lines": "224-240",
    "id": "feature-jsx#LiveEmbed"
  },
  "sourceAlternates": [],
  "semantic": {
    "id": "media.live-embed",
    "category": "MEDIA"
  },
  "retrievalEligible": true,
  "content": {
    "fields": {
      "h2": {
        "type": "text",
        "maxWords": 3,
        "required": true
      },
      "lede": {
        "type": "text",
        "maxWords": 15,
        "required": true
      },
      "embed": {
        "type": "asset",
        "roles": [
          "embedded-app"
        ],
        "required": true
      }
    },
    "copyBudgetBasis": "estimated: layout-fit budgets set from the placeholder lengths recorded in the page specs; see extraction/measured-values.json copyBudgets for the role-class maxima that were verified"
  },
  "variants": [
    "default"
  ],
  "allowedSurfaces": [
    "cream"
  ],
  "constraints": {},
  "motion": {
    "allowedPatterns": [
      "none"
    ],
    "default": "none",
    "reducedMotionFallback": "static"
  },
  "responsive": {
    "columns": {
      "xl": 1,
      "lg": 1,
      "md": 1,
      "sm": 1
    },
    "stackBelowPx": null,
    "hiddenBelowPx": null,
    "evidence": "no section-specific breakpoint behaviour is recorded in the page specs; the section follows the container grid"
  },
  "generatedAssetRoles": [
    "placeholder-embed"
  ],
  "evidence": {
    "level": "measured",
    "specRefs": [
      {
        "doc": "PAGES_SPEC_MARKETING.md",
        "lines": "278-299",
        "heading": "B15. `CTA`-less helpers on product pages"
      }
    ],
    "note": null
  },
  "usedInTemplates": [
    "product-feature"
  ],
  "tags": []
}
