{
  "$schema": "../schema/section-contract.schema.json",
  "id": "feature.feature-grid",
  "kind": "section",
  "version": "1.0.0",
  "title": "Feature grid",
  "purpose": "Grid of six feature cards with icon, title and body.",
  "source": {
    "file": "src/components/marketing/persona.jsx",
    "tag": "FeatureGrid",
    "lines": "158-181",
    "id": "persona-jsx#FeatureGrid"
  },
  "sourceAlternates": [],
  "semantic": {
    "id": "feature.feature-grid",
    "category": "FEATURES"
  },
  "retrievalEligible": true,
  "content": {
    "fields": {
      "h2": {
        "type": "text",
        "maxWords": 8,
        "required": true
      },
      "cards": {
        "type": "list",
        "minItems": 6,
        "maxItems": 6,
        "item": {
          "title": {
            "type": "text",
            "maxWords": 6,
            "required": true
          },
          "body": {
            "type": "text",
            "maxWords": 30,
            "required": true
          },
          "icon": {
            "type": "asset",
            "roles": [
              "spot-illustration",
              "generic-ui-glyph"
            ],
            "required": true
          }
        },
        "required": true
      }
    },
    "copyBudgetBasis": "estimated: layout-fit budgets set from the placeholder lengths recorded in the page specs; see extraction/measured-values.json copyBudgets for the role-class maxima that were verified"
  },
  "variants": [
    "default"
  ],
  "allowedSurfaces": [
    "cream"
  ],
  "constraints": {},
  "motion": {
    "allowedPatterns": [
      "none"
    ],
    "default": "none",
    "reducedMotionFallback": "static"
  },
  "responsive": {
    "columns": {
      "xl": 3,
      "lg": 3,
      "md": 2,
      "sm": 1
    },
    "stackBelowPx": null,
    "hiddenBelowPx": null,
    "evidence": "PAGES_SPEC_MARKETING B18"
  },
  "generatedAssetRoles": [
    "generated-illustration",
    "generic-ui-glyph"
  ],
  "evidence": {
    "level": "measured",
    "specRefs": [
      {
        "doc": "PAGES_SPEC_MARKETING.md",
        "lines": "338-381",
        "heading": "B18. Persona blocks (T3, /product)"
      }
    ],
    "note": null
  },
  "usedInTemplates": [
    "product-overview",
    "product-persona"
  ],
  "tags": []
}
