{
  "$schema": "../schema/section-contract.schema.json",
  "id": "social-proof.testimonials",
  "kind": "section",
  "version": "1.0.0",
  "title": "Employee testimonials carousel",
  "purpose": "Vertical (horizontal on smaller screens) carousel of three employee quotes with portraits.",
  "source": {
    "file": "src/components/company/careers.jsx",
    "tag": "Testimonials",
    "lines": "466-533",
    "id": "careers-jsx#Testimonials"
  },
  "sourceAlternates": [],
  "semantic": {
    "id": "social-proof.testimonials",
    "category": "SOCIAL_PROOF"
  },
  "retrievalEligible": true,
  "content": {
    "fields": {
      "slides": {
        "type": "list",
        "minItems": 3,
        "maxItems": 3,
        "item": {
          "quote": {
            "type": "text",
            "maxWords": 40,
            "required": true
          },
          "name": {
            "type": "text",
            "maxWords": 3,
            "required": true
          },
          "role": {
            "type": "text",
            "maxWords": 5,
            "required": true
          },
          "portrait": {
            "type": "asset",
            "roles": [
              "person-portrait"
            ],
            "required": true
          }
        },
        "required": true
      }
    },
    "copyBudgetBasis": "estimated: layout-fit budgets set from the placeholder lengths recorded in the page specs; see extraction/measured-values.json copyBudgets for the role-class maxima that were verified"
  },
  "variants": [
    "default"
  ],
  "allowedSurfaces": [
    "cream"
  ],
  "constraints": {},
  "motion": {
    "allowedPatterns": [
      "carousel-swipe"
    ],
    "default": "carousel-swipe",
    "reducedMotionFallback": "static"
  },
  "responsive": {
    "columns": {
      "xl": 1,
      "lg": 1,
      "md": 1,
      "sm": 1
    },
    "stackBelowPx": null,
    "hiddenBelowPx": null,
    "evidence": "no section-specific breakpoint behaviour is recorded in the page specs; the section follows the container grid"
  },
  "generatedAssetRoles": [
    "fictional-person-avatar"
  ],
  "evidence": {
    "level": "measured",
    "specRefs": [
      {
        "doc": "PAGES_SPEC_COMPANY.md",
        "lines": "224-230",
        "heading": "B7. `TestimonialCarousel` [NEW] (Careers), preceded by the dark TickerBand \"JOIN THE FLOCK"
      }
    ],
    "note": null
  },
  "usedInTemplates": [
    "careers"
  ],
  "tags": []
}
