{
  "$schema": "../schema/section-contract.schema.json",
  "id": "pricing.tier-cards",
  "kind": "section",
  "version": "1.0.0",
  "title": "Pricing tier cards",
  "purpose": "Plan cards with price, billing strip, feature bullets and a tier action.",
  "source": {
    "file": "src/components/marketing/pricing.jsx",
    "tag": "TierCards",
    "lines": "76-120",
    "id": "pricing-jsx#TierCards"
  },
  "sourceAlternates": [],
  "semantic": {
    "id": "pricing.tier-cards",
    "category": "PRICING"
  },
  "retrievalEligible": true,
  "content": {
    "fields": {
      "tiers": {
        "type": "list",
        "minItems": 2,
        "maxItems": 3,
        "item": {
          "name": {
            "type": "text",
            "maxWords": 2,
            "required": true
          },
          "price": {
            "type": "text",
            "maxWords": 2,
            "required": true
          },
          "unit": {
            "type": "text",
            "maxWords": 4,
            "required": false
          },
          "bullets": {
            "type": "list",
            "minItems": 2,
            "maxItems": 8,
            "item": {
              "text": {
                "type": "text",
                "maxWords": 10,
                "required": true
              }
            },
            "required": true
          },
          "action": {
            "type": "link",
            "labelMaxWords": 3,
            "required": true
          }
        },
        "required": true
      },
      "annualStrip": {
        "type": "text",
        "maxWords": 14,
        "required": false
      }
    },
    "copyBudgetBasis": "estimated: layout-fit budgets set from the placeholder lengths recorded in the page specs; see extraction/measured-values.json copyBudgets for the role-class maxima that were verified"
  },
  "variants": [
    "default"
  ],
  "allowedSurfaces": [
    "cream"
  ],
  "constraints": {
    "maxPerPage": 1
  },
  "motion": {
    "allowedPatterns": [
      "offset-lift"
    ],
    "default": "offset-lift",
    "reducedMotionFallback": "static"
  },
  "responsive": {
    "columns": {
      "xl": 3,
      "lg": 3,
      "md": 1,
      "sm": 1
    },
    "stackBelowPx": null,
    "hiddenBelowPx": null,
    "evidence": "PAGES_SPEC_MARKETING B20"
  },
  "generatedAssetRoles": [],
  "evidence": {
    "level": "measured",
    "specRefs": [
      {
        "doc": "PAGES_SPEC_MARKETING.md",
        "lines": "391-432",
        "heading": "B20. Pricing blocks"
      }
    ],
    "note": null
  },
  "usedInTemplates": [
    "pricing"
  ],
  "tags": []
}
