{
  "$schema": "../schema/section-contract.schema.json",
  "id": "hero.events",
  "kind": "section",
  "version": "1.0.0",
  "title": "Events hero",
  "purpose": "Page-opening: heading and lede for the events listing.",
  "source": {
    "file": "src/pages/content/EventsHub.jsx",
    "tag": "EventsHero",
    "lines": "19-42",
    "id": "EventsHub-jsx#EventsHero"
  },
  "sourceAlternates": [],
  "semantic": {
    "id": "hero.events",
    "category": "HERO"
  },
  "retrievalEligible": true,
  "content": {
    "fields": {
      "h1": {
        "type": "text",
        "maxWords": 6,
        "required": true
      },
      "lede": {
        "type": "text",
        "maxWords": 25,
        "required": true
      }
    },
    "copyBudgetBasis": "estimated: layout-fit budgets set from the placeholder lengths recorded in the page specs; see extraction/measured-values.json copyBudgets for the role-class maxima that were verified"
  },
  "variants": [
    "default"
  ],
  "allowedSurfaces": [
    "cream"
  ],
  "constraints": {
    "onePerPage": true,
    "mustFollowNav": true
  },
  "motion": {
    "allowedPatterns": [
      "none"
    ],
    "default": "none",
    "reducedMotionFallback": "static"
  },
  "responsive": {
    "columns": {
      "xl": 1,
      "lg": 1,
      "md": 1,
      "sm": 1
    },
    "stackBelowPx": null,
    "hiddenBelowPx": null,
    "evidence": "no section-specific breakpoint behaviour is recorded in the page specs; the section follows the container grid"
  },
  "generatedAssetRoles": [],
  "evidence": {
    "level": "measured",
    "specRefs": [
      {
        "doc": "PAGES_SPEC_CONTENT.md",
        "lines": "539-546",
        "heading": "H1. `EventsHero` [NEW]"
      }
    ],
    "note": null
  },
  "usedInTemplates": [
    "events-index",
    "events-past"
  ],
  "tags": []
}
