{
  "$schema": "../schema/section-contract.schema.json",
  "id": "lp.authors",
  "kind": "section",
  "version": "1.0.0",
  "title": "Meet the authors",
  "purpose": "LP band with two author portraits and bios.",
  "source": {
    "file": "src/components/company/lp.jsx",
    "tag": "AuthorsGrid",
    "lines": "293-306",
    "id": "lp-jsx#AuthorsGrid"
  },
  "sourceAlternates": [],
  "semantic": {
    "id": "lp.authors",
    "category": "EDITORIAL"
  },
  "retrievalEligible": true,
  "content": {
    "fields": {
      "h2": {
        "type": "text",
        "maxWords": 4,
        "required": true
      },
      "intro": {
        "type": "text",
        "maxWords": 14,
        "required": false
      },
      "authors": {
        "type": "list",
        "minItems": 1,
        "maxItems": 2,
        "item": {
          "portrait": {
            "type": "asset",
            "roles": [
              "person-portrait"
            ],
            "required": true
          },
          "bio": {
            "type": "text",
            "maxWords": 95,
            "required": true
          },
          "name": {
            "type": "text",
            "maxWords": 3,
            "required": false
          }
        },
        "required": true
      }
    },
    "copyBudgetBasis": "estimated: layout-fit budgets set from the placeholder lengths recorded in the page specs; see extraction/measured-values.json copyBudgets for the role-class maxima that were verified"
  },
  "variants": [
    "default"
  ],
  "allowedSurfaces": [
    "sun"
  ],
  "constraints": {},
  "motion": {
    "allowedPatterns": [
      "none"
    ],
    "default": "none",
    "reducedMotionFallback": "static"
  },
  "responsive": {
    "columns": {
      "xl": 1,
      "lg": 1,
      "md": 1,
      "sm": 1
    },
    "stackBelowPx": null,
    "hiddenBelowPx": null,
    "evidence": "no section-specific breakpoint behaviour is recorded in the page specs; the section follows the container grid"
  },
  "generatedAssetRoles": [
    "fictional-person-avatar"
  ],
  "evidence": {
    "level": "measured",
    "specRefs": [
      {
        "doc": "PAGES_SPEC_COMPANY.md",
        "lines": "278-304",
        "heading": "G. Gated LP template blocks"
      }
    ],
    "note": null
  },
  "usedInTemplates": [
    "gated-lp",
    "lp-book-own-nav"
  ],
  "tags": []
}
